用户ID,用户昵称,用户头像地址,评论时间,点赞总数,评论内容
327950181,甩的球技能,http://p1.music.126.net/ishwjnlWcdijQi1SHx_4-w==/109951163010797208.jpg,1539174147106,0,我不知道你是否能明白..就是有一次 我看到她 泪水不断地从眼睛里涌出..那时我就暗自决定 自己不会再让她哭泣..永远不
1427043394,很遗憾你,http://p1.music.126.net/kdvng8fbQ9nJQ58Ww7dDwA==/109951163399598978.jpg,1539174120092,2,凭什么改掉我的所有 所有小脾气
我可以自己去吃很多 很多好东西
我可以自己制造很多 很多小甜蜜
就像前几年那样每天 都会给你制造很多惊喜
我的心伤是你给予
我的快乐 已经被你全索取
我们就别再一起
361327075,惊世蜉蝣,http://p1.music.126.net/h92CkcQwkQPGOLFYR5vcLw==/109951163557889562.jpg,1539174093588,0,特别黏男朋友会不会不好啊
553506289,你会不会跟我一起走i,http://p1.music.126.net/tkBswZWgd4GYXXqPaeztzg==/109951163342598795.jpg,1539174087108,0,特别喜欢这一句:我的快乐只有你能给予
